<?xml version="1.0" encoding="UTF-8"?>
<thesaurus xmlns:dc="http://purl.org/dc/terms/"
    xmlns="http://data.gbif.org/thesaurus"
 xmlns:xsi="http://www.w3.org/2001/XMLSchema-instance"
 xsi:schemaLocation="http://data.gbif.org/thesaurus  thesaurus.xsd">
    <concept dc:identifier="http://iso.org/3166#US" iso3Digit="USA" iso2Digit="US" dc:type="http://iso.org/3166#country" dc:issued="2006-05-04T18:13:51.0Z">
        <accepted>
            <term dc:title="United States of America" dc:lang="en" dc:source="source0" dc:created="2006-05-04T18:13:51.0Z" dc:modified="2006-05-04T18:13:51.0Z"/>
            <term dc:title="Vereinigte Staaten von Amerika" dc:lang="de" dc:source="source1" dc:created="2006-05-04T18:13:51.0Z" dc:modified="2006-05-04T18:13:51.0Z"/>
        </accepted>
        <synonym>
            <term dc:title="USA" dc:lang="en" dc:source="source3" dc:created="2006-05-04T18:13:51.0Z" dc:modified="2006-05-04T18:13:51.0Z"/>
            <term dc:title="US of A" dc:lang="en" dc:source="source4" dc:created="2006-05-04T18:13:51.0Z" dc:modified="2006-05-04T18:13:51.0Z"/>
            <term dc:title="United States" dc:lang="en" dc:source="source5" dc:created="2006-05-04T18:13:51.0Z" dc:modified="2006-05-04T18:13:51.0Z"/>
        </synonym>
    </concept>

    <concept dc:identifier="http://rs.tdwg.org/ontology/voc/TaxonRank#Species" dc:type="http://rs.tdwg.org/ontology/voc/TaxonRank" dc:issued="2006-05-04T18:13:51.0Z">
        <accepted>
            <term dc:title="Species" dc:lang="en" dc:source="source12" dc:created="2006-05-04T18:13:51.0Z" dc:modified="2006-05-04T18:13:51.0Z"/>
            <term dc:title="Art" dc:lang="de" dc:source="source13" dc:created="2006-05-04T18:13:51.0Z" dc:modified="2006-05-04T18:13:51.0Z"/>
        </accepted>
        <synonym>
            <term dc:title="Spec." dc:lang="en" dc:source="source15" dc:created="2006-05-04T18:13:51.0Z" dc:modified="2006-05-04T18:13:51.0Z"/>
            <term dc:title="Sp." dc:lang="en" dc:source="source16" dc:created="2006-05-04T18:13:51.0Z" dc:modified="2006-05-04T18:13:51.0Z"/>
            <term dc:title="Spec" dc:lang="en" dc:source="source17" dc:created="2006-05-04T18:13:51.0Z" dc:modified="2006-05-04T18:13:51.0Z"/>
        </synonym>
    </concept>
</thesaurus>
